{
  "$schema": "https://json-schema.org/draft/2020-12/schema",
  "type": "array",
  "items": {
    "type": "object",
    "properties": {
      "id": {
        "type": "string",
        "description": "The Gemini API model id, exactly as the API expects it, e.g. 'gemini-3.8-flash'."
      },
      "enabled": {
        "type": "boolean",
        "description": "false keeps the settings on file but leaves the model out of the rotation (it can still be forced with --models)."
      },
      "batchSize": {
        "type": "integer",
        "exclusiveMinimum": 0,
        "maximum": 9007199254740991,
        "description": "Apps per request."
      },
      "requestsPerMinute": {
        "type": "number",
        "exclusiveMinimum": 0,
        "description": "Request pacing for this model — at or below its per-minute request quota."
      },
      "reasoning": {
        "type": "string",
        "enum": ["minimal", "low", "medium", "high"],
        "description": "Gemini thinkingLevel ('minimal' is its floor) — reasoning tokens count against quota, and classifying from a name + one line rarely needs more than 'low'."
      },
      "overloadRetries": {
        "type": "integer",
        "minimum": 0,
        "maximum": 9007199254740991,
        "description": "Same-model retries on an overload error (5xx) before moving on to the next model. 0 when failed requests count against the daily quota (observed on Gemini's free tier)."
      },
      "reason": {
        "type": "string",
        "description": "Why this model is in the list, at this position, with these settings — so a later edit knows what it's trading off."
      }
    },
    "required": [
      "id",
      "enabled",
      "batchSize",
      "requestsPerMinute",
      "reasoning",
      "overloadRetries",
      "reason"
    ],
    "additionalProperties": false
  },
  "title": "Enrich: LLM models",
  "description": "The Gemini models `pnpm classify-llm` rotates through, in priority order, with per-model batch size, pacing, reasoning effort, and overload-retry settings tuned to the free-tier quota."
}
