[
  {
    "id": "gemini-3.1-flash-lite",
    "enabled": true,
    "batchSize": 200,
    "requestsPerMinute": 5,
    "reasoning": "minimal",
    "overloadRetries": 0,
    "reason": "First in the chain: it produced 53,648 of the 55,565 entries of the 2026-10-04 run anyway, while the Flash models (20 requests/day each) were mostly 503. On a 118-app hand-labelled sample (2026-10-04, 60-app batches) it scored 95% right type and 91% right type + category, with zero real app called library/other at high confidence. Own free daily quota, separate from the Flash models'. Same request-capped settings; reasoning 'minimal' keeps output lean. Check its requests/day in AI Studio before raising batchSize."
  },
  {
    "id": "gemini-3.8-flash",
    "enabled": true,
    "batchSize": 200,
    "requestsPerMinute": 5,
    "reasoning": "low",
    "overloadRetries": 0,
    "reason": "Best-calibrated model on the 2026-09-25 side-by-side samples. Gemini's free tier caps requests (20/day per model), not tokens, so batches are as large as a 200-app sample showed still come back complete. No overload retry: 503s count against the daily cap."
  },
  {
    "id": "gemini-3.6-flash",
    "enabled": true,
    "batchSize": 200,
    "requestsPerMinute": 5,
    "reasoning": "low",
    "overloadRetries": 0,
    "reason": "Close to 3.8 Flash on a 20-app sample and often less overloaded. Same request-capped settings as 3.8 Flash."
  },
  {
    "id": "gemini-3.5-flash-lite",
    "enabled": true,
    "batchSize": 200,
    "requestsPerMinute": 5,
    "reasoning": "minimal",
    "overloadRetries": 0,
    "reason": "Last fallback: one more separate free daily quota. On the 118-app hand-labelled sample (2026-10-04) it scored 91% right type but only 83% right type + category, and caught fewer libraries (20/30) than gemini-3.1-flash-lite (26/30). Hence last."
  }
]
